{
  "schema_version": "1.0.0",
  "document_type": "review-decision",
  "document_id": "fixture-decision_001",
  "created_at": "2026-01-01T00:00:00Z",
  "workspace": "workspace_demo",
  "source_id": "src_synthetic_01",
  "source_hash": {
    "algorithm": "sha256",
    "value": "1111111111111111111111111111111111111111111111111111111111111111"
  },
  "review_generation": 1,
  "producer": {
    "kind": "ENGINE",
    "name": "s9k-data-engine",
    "version": "0.0.0-test",
    "model": null
  },
  "provenance": {
    "source_id": "src_synthetic_01",
    "source_hash": {
      "algorithm": "sha256",
      "value": "1111111111111111111111111111111111111111111111111111111111111111"
    },
    "review_generation": 1,
    "pipeline_version": "0.0.0-test",
    "producer": {
      "kind": "ENGINE",
      "name": "s9k-data-engine",
      "version": "0.0.0-test",
      "model": null
    }
  },
  "decision_id": "dec_synth_001",
  "candidate_id": "cand_synth_001",
  "action": "APPROVE",
  "reviewer_type": "HUMAN",
  "reviewer_id": "operador_demo",
  "decided_at": "2026-01-01T00:05:00Z",
  "reason_code": "HUMAN_CONFIRMED",
  "comment": "confirmado en laboratorio",
  "expected_candidate_hash": {
    "algorithm": "sha256",
    "value": "1111111111111111111111111111111111111111111111111111111111111111"
  },
  "decision_hash": {
    "algorithm": "sha256",
    "value": "2222222222222222222222222222222222222222222222222222222222222222"
  }
}
